Title,url,Word count,# of Links,# of comments,# Images video,Elapsed days,# Shares
What is Machine Learning and how do we use it in Signals?,https://blog.signals.network/what-is-machine-learning-and-how-do-we-use-it-in-signals-6797e720d636,1888,1,2,2,34,200000
10 Companies Using Machine Learning in Cool Ways,,1742,9,,9,5,25000
How Artificial Intelligence Is Revolutionizing the Sector,,962,6,0,1,10,42000
Dbrain and the Blockchain of Artificial Intelligence,,1221,3,,2,68,200000
Nasa finds entire solar system filled with eight planets like our own,,2039,1,104,4,131,200000
5 ways Data Science and Machine Learning impact business,,761,0,,1,14,21000
200 universities just launched 600 free online courses. Here’s the full list.,https://qz.com/1120344/200-universities-just-launched-600-free-online-courses-heres-the-full-list/,6462,600,28,2,170,200000
How Machine Learning can help Cryptocurrency Traders Maximize their Gains,https://cryptovest.com/news/how-machine-learning-can-help-cryptocurrency-traders-maximize-their-gains/?utm_source=SocialAnimal&utm_medium=referral,753,3,0,1,78,77000
Tech companies should stop pretending AI won’t destroy jobs,https://www.technologyreview.com/s/610298/tech-companies-should-stop-pretending-ai-wont-destroy-jobs/,1118,2,,1,62,59400
Artificial intelligence is going to completely change your life,,1581,4,,2,60,35000
Facebook robots shut down after they talk to each other in language only they understand ,,2090,1,95,1,267,100000
A visual introduction to machine learning,http://www.r2d3.us/visual-intro-to-machine-learning-part-1/?utm_source=SocialAnimal&utm_medium=referral,1099,4,,15,1002,350000
10 Breakthrough Technologies 2018,,3900,30,,10,62,20000
Google CEO Sundar Pichai says AI is more profound than electricity or fire,,256,0,27,1,95,29000
How machine learning is changing the financial industry,,1267,2,,4,124,37000
New AI can work out whether you're gay or straight from a photograph,https://www.theguardian.com/technology/2017/sep/07/new-artificial-intelligence-can-tell-whether-youre-gay-or-straight-from-a-photograph,971,10,,1,228,67300
Researchers have linked a human brain to the Internet for the first time ever,https://futurism.com/researchers-have-linked-a-human-brain-to-the-internet-for-the-first-time-ever/,369,6,,1,222,60100
Who’s a good AI? Dog-based data creates a canine machine learning system,https://techcrunch.com/2018/04/11/whos-a-good-ai-dog-based-data-creates-a-canine-machine-learning-system/,635,3,1,2,12,3200
Which One to Choose for Your Problem ,,1631,6,6,9,180,37000
A computer was asked to predict which start-ups would be successful. The results were astonishing,,571,4,,1,277,55000
AI Is Inventing Languages Humans Can’t Understand. Should We Stop It?,https://www.fastcodesign.com/90132632/ai-is-inventing-its-own-perfect-languages-should-we-let-it,1333,8,,4,284,54800
An Artificial Intelligence Developed Its Own Non-Human Language,https://www.theatlantic.com/technology/archive/2017/06/artificial-intelligence-develops-its-own-non-human-language/530436/,364,5,,2,313,54600
Denmark's largest bank is using AI and machine learning to ‘tear everything apart’ – and it’s starting to pay off,,515,2,,5,173,27000
How Artificial Intelligence Is Key for Autonomous Vehicle Development,,1135,8,0,1,146,20000
Machine Learning Zone: OpenAI competition takes on Sonic the Hedgehog,,666,4,0,3,18,2400
How neural networks are trained,https://ml4a.github.io/ml4a/how_neural_networks_are_trained/,8401,30,,21,113,14000
Reverie Labs uses new machine learning algorithms to fix drug development bottlenecks,,787,4,0,1,39,3800
"Machine Learning Applied to Big Data, Explained",,421,2,,1,277,26000
Physicists have discovered what makes neural networks so extraordinarily powerful ,,1065,1,19,1,171,14000
Turning Design Mockups Into Code With Deep Learning,,5892,21,,20,104,7100
A deep-learning machine was trained to spot criminals by looking at mugshots,,908,2,,1,226,14000
Getting Value from MachineLearning Isn’t About Fancier Algorithms — It’s About Making It Easier to Use,,1260,6,4,1,49,3000
The Amazing Ways Tesla Is Using Artificial Intelligence And Big Data,,950,6,,1,106,5600
10 Machine LearningAlgorithms You Should Know to Become a Data Scientist - DZone AI,,1761,49,4,10,30,1500
Google’s Artificial-Intelligence Wizard Unveils a New Twist on Neural Networks,,911,10,23,1,174,8400
and the part artificial intelligence has to play ,,971,5,,2,127,5300
How Amazon Rebuilt Itself Around Artificial Intelligence,,4420,13,12,8,82,3400
Feature Labs launches out of MIT to accelerate the development of machinelearning algorithms,,458,1,0,2,61,2500
CometML wants to do for machine learning what GitHub did for code,,458,3,0,3,19,757
Why it’s a big deal that AI knows how to bluff in poker,,782,8,5,1,176,6400
Discussing the limits of artificial intelligence,,2080,4,0,4,127,3600
Crean inteligencia artificial para evaluar incendios y catástrofes naturales,https://www.fayerwayer.com/2018/04/crean-inteligencia-artificial-evaluar-incendios-catastrofes-naturales,250,4,1,2,1,22
"What's the difference between data science, machinelearning, and artificialintelligence?",http://varianceexplained.org/r/ds-ml-ai/,1763,1,29,1,105,2300
The Artificial Intelligence Startups Redefining Industries,,650,10,0,3,133,2800
Top 20 PythonAI and MachineLearning Open Source Projects,https://www.kdnuggets.com/2018/02/top-20-python-ai-machine-learning-open-source-projects.html,1184,39,8,1,63,1300
5 Key Artificial IntelligencePredictions For 2018: HowMachine Learning Will Change Everything,https://www.forbes.com/sites/bernardmarr/2017/12/18/5-key-artificial-intelligence-predictions-for-2018-how-machine-learning-will-change-everything/,957,9,,1,127,2500
"Pythonovertakes R, becomes the leader in Data Science, MachineLearningplatforms",https://www.kdnuggets.com/2017/08/python-overtakes-r-leader-analytics-data-science.html,627,2,5,4,239,4500
¿Podremos crear máquinas verdaderamente inteligentes?,https://elpais.com/tecnologia/2018/03/27/actualidad/1522139782_730950.html,895,1,13,1,23,422
Artificial Intelligence Isn't Killing Jobs; It's Killing Business Models,,1097,2,,1,89,1600
3 Things AI Can Already Do for Your Company ,,4437,3,2,3,113,2000
10 Ways Machine Learning Is Revolutionizing Manufacturing In 2018,https://www.forbes.com/sites/louiscolumbus/2018/03/11/10-ways-machine-learning-is-revolutionizing-manufacturing-in-2018/#7199e52623ac,1262,10,,10,44,715
10 Ways Machine Learning Is Revolutionizing Marketing,https://www.forbes.com/sites/louiscolumbus/2018/02/25/10-ways-machine-learning-is-revolutionizing-marketing/#4219d395bb64,1738,32,,9,58,907
Top 10 Machine LearningAlgorithms for Beginners,,1813,6,,5,186,2800
A Tour of The Top 10 Algorithms for MachineLearning Newbies,,2400,5,21,11,94,1300
"What’s the difference betweenartificial intelligence, machinelearning, and deep learning? | Qualcomm",https://www.qualcomm.com/news/onq/2017/09/01/whats-difference-between-artificial-intelligence-machine-learning-and-deep,662,2,,4,234,3000
"How Quantum Computers Will Revolutionize ArtificialIntelligence, MachineLearning And Big Data",https://www.forbes.com/sites/bernardmarr/2017/09/05/how-quantum-computers-will-revolutionize-artificial-intelligence-machine-learning-and-big-data/,800,6,,2,231,2800
"Jack Ma: Artificialintelligence, machine learningmay cause World War III",http://www.businessinsider.com/alibaba-stock-price-jack-ma-artificial-intelligence-machine-learning-may-cause-world-war-iii-2017-6,367,5,,1,307,3300
Google and MIT’s new machine learning algorithmsretouch your photos before you take them,,507,8,13,2,265,2600
How to create a NeuralNetwork in JavaScript in only 30 lines of code,,992,10,30,6,250,2300
PythonOvertakes R for Data Science and MachineLearning,https://www.datasciencecentral.com/profiles/blogs/python-overtakes-r-for-data-science-and-machine-learning,499,10,5,2,237,1400
Salesforce created an algorithm that automatically summarizes text using machine learning,,619,10,3,1,345,1800
Construir inteligencia artificial que construya inteligencia artificial,https://www.nytimes.com/es/2017/11/07/inteligencia-artificial-auto-ml-google/,1152,8,,3,168,867
MachineLearningWorkflows in Python from Scratch Part 1: Data Preparation,https://www.kdnuggets.com/2017/05/machine-learning-workflows-python-scratch-part-1.html,2363,4,,4,330,1500
Por qué ‘machine learning’ sera la tecnología más importante en 2018,https://elpais.com/tecnologia/2017/11/28/actualidad/1511866764_933798.html,988,1,0,1,147,631
Get started with machinelearning using Python,https://www.analyticsvidhya.com/blog/2017/05/pydata-amsterdam-2017-machine-learning-deep-learning-data-science/,759,20,1,1,328,1200
MachineLearningExercises in Python: An Introductory Tutorial Series,https://www.kdnuggets.com/2017/07/machine-learning-exercises-python-introductory-tutorial-series.html,1098,8,,3,272,950
"22 talks from PyData 2017 | Deep Learning, MachineLearning & NLP",https://www.analyticsvidhya.com/blog/2017/05/pydata-amsterdam-2017-machine-learning-deep-learning-data-science/,2797,22,7,22,349,1200
La inteligencia artificial ya diagnostica enfermedades tan bien como los médicos,http://www.lavanguardia.com/ciencia/cuerpo-humano/20180223/44950677766/inteligencia-artificial-machine-learning-diagnosticar-enfermedades-medicos-eficiencia.html?platform=hootsuite,1120,2,0,4,60,196
Modern Machine LearningAlgorithms: Strengths and Weaknesses,,2488,11,,5,343,1100
Core ML and Vision: MachineLearning in iOS 11 Tutorial,https://www.raywenderlich.com/164213/coreml-and-vision-machine-learning-in-ios-11-tutorial,2049,12,23,7,319,668
Tutorial to deploy Machine Learning models in Production as APIs (using Flask),https://www.analyticsvidhya.com/blog/2017/09/machine-learning-models-as-apis-using-flask/,2542,2,0,4,208,424
Getting the NDA out of the Way with Machine Learning,https://blog.bigml.com/2018/04/18/getting-the-nda-out-of-the-way-with-machine-learning/,1011,15,0,2,6,8
Tutorial on Automated MachineLearning using MLBox,https://www.analyticsvidhya.com/blog/2017/07/mlbox-library-automated-machine-learning/,2189,3,11,8,292,367